{
  "schema_version": "0.20.0",
  "id": "tide-lab",
  "topic_id": "physical.earth.universe",
  "title": "潮汐周期与月相实验室",
  "review_after_hours": 48,
  "model_note": "采用高中理想模型：月球引潮作用为主，太阳引潮作用较弱；日月地近似成线时两者叠加形成大潮，太阳与月球方向近似垂直时部分抵消形成小潮。图示只表达相对潮差，不预测某港口的准确潮时与潮高。",
  "cases": [
    { "id": "new-moon", "name": "新月大潮", "phase": "新月", "angle_deg": 0, "geometry": "日、月位于地球同侧，三者近似成线", "tide_type": "大潮", "range": "潮差通常较大", "trend": "大潮附近", "category": "spring" },
    { "id": "waxing-crescent", "name": "蛾眉月过渡潮", "phase": "蛾眉月", "angle_deg": 45, "geometry": "日月方向夹角约45°", "tide_type": "大潮与小潮之间的过渡潮", "range": "潮差总体由大变小", "trend": "向小潮过渡", "category": "transition" },
    { "id": "first-quarter", "name": "上弦月小潮", "phase": "上弦月", "angle_deg": 90, "geometry": "太阳与月球方向近似垂直", "tide_type": "小潮", "range": "潮差通常较小", "trend": "小潮附近", "category": "neap" },
    { "id": "waxing-gibbous", "name": "盈凸月过渡潮", "phase": "盈凸月", "angle_deg": 135, "geometry": "日月方向夹角约135°", "tide_type": "大潮与小潮之间的过渡潮", "range": "潮差总体由小变大", "trend": "向大潮过渡", "category": "transition" },
    { "id": "full-moon", "name": "满月大潮", "phase": "满月", "angle_deg": 180, "geometry": "日、地、月近似成线", "tide_type": "大潮", "range": "潮差通常较大", "trend": "大潮附近", "category": "spring" },
    { "id": "waning-gibbous", "name": "亏凸月过渡潮", "phase": "亏凸月", "angle_deg": 225, "geometry": "日月方向夹角约135°", "tide_type": "大潮与小潮之间的过渡潮", "range": "潮差总体由大变小", "trend": "向小潮过渡", "category": "transition" },
    { "id": "last-quarter", "name": "下弦月小潮", "phase": "下弦月", "angle_deg": 270, "geometry": "太阳与月球方向近似垂直", "tide_type": "小潮", "range": "潮差通常较小", "trend": "小潮附近", "category": "neap" },
    { "id": "waning-crescent", "name": "残月过渡潮", "phase": "残月", "angle_deg": 315, "geometry": "日月方向夹角约45°", "tide_type": "大潮与小潮之间的过渡潮", "range": "潮差总体由小变大", "trend": "向大潮过渡", "category": "transition" }
  ],
  "scenarios": [
    {
      "id": "TD-01", "case_id": "new-moon", "challenge": "新月当天，日月引潮作用如何组合，潮差通常有何特征？",
      "observations": ["太阳、月球位于地球同一方向", "月球引潮作用为主，太阳引潮作用方向与其近似重合", "某海岸当天出现两次高潮，但具体时刻并非简单等于月球过中天"],
      "choices": {
        "geometry": ["日、月位于地球同侧，三者近似成线", "太阳与月球方向近似垂直", "日、地、月近似成线", "日月方向没有任何规律"],
        "tide_type": ["大潮", "小潮", "大潮与小潮之间的过渡潮", "无潮汐"],
        "range": ["潮差通常较大", "潮差通常较小", "高潮与低潮水位完全相同", "全球各港口潮差完全一致"],
        "cycle": ["多数海岸一个太阴日约24时50分，常见两次高潮约相隔12时25分", "高潮每天固定在太阳正午", "两次高潮严格相隔24小时", "全球海岸每天都只有一次高潮"],
        "conclusion": ["可判断大潮倾向；准确潮时、潮高仍需当地潮汐资料", "新月当天全球同时达到相同高潮", "大潮只在春季发生", "月球过中天时任何海岸必定立即高潮"]
      },
      "answers": { "geometry": "日、月位于地球同侧，三者近似成线", "tide_type": "大潮", "range": "潮差通常较大", "cycle": "多数海岸一个太阴日约24时50分，常见两次高潮约相隔12时25分", "conclusion": "可判断大潮倾向；准确潮时、潮高仍需当地潮汐资料" }
    },
    {
      "id": "TD-02", "case_id": "waxing-crescent", "challenge": "新月以后几天，潮差通常朝哪个方向变化？",
      "observations": ["月球已离开日地连线", "日月方向夹角逐渐接近90°", "太阳和月球引潮作用的叠加程度减弱"],
      "choices": {
        "geometry": ["日月方向夹角约45°", "太阳与月球方向近似垂直", "日、地、月近似成线", "日、月位于地球同侧且完全重合"],
        "tide_type": ["大潮与小潮之间的过渡潮", "大潮", "小潮", "永久无潮"],
        "range": ["潮差总体由大变小", "潮差总体由小变大", "潮差立即变为零", "各地潮差都不再变化"],
        "cycle": ["约四分之一个朔望月后接近上弦月小潮", "一天后必到满月大潮", "一年后才出现小潮", "每个季节只发生一次小潮"],
        "conclusion": ["月相可判断总体趋势；某港口变化幅度仍受当地条件影响", "只凭月相可精确报出任何港口潮高", "过渡潮说明月球引力消失", "潮差变化只由气温决定"]
      },
      "answers": { "geometry": "日月方向夹角约45°", "tide_type": "大潮与小潮之间的过渡潮", "range": "潮差总体由大变小", "cycle": "约四分之一个朔望月后接近上弦月小潮", "conclusion": "月相可判断总体趋势；某港口变化幅度仍受当地条件影响" }
    },
    {
      "id": "TD-03", "case_id": "first-quarter", "challenge": "上弦月时，两种引潮作用怎样组合，潮差通常有何特征？",
      "observations": ["从地球看太阳与月球方向约成直角", "两种引潮作用的长轴方向不同", "当地潮位仍在周期性升降"],
      "choices": {
        "geometry": ["太阳与月球方向近似垂直", "日、月位于地球同侧，三者近似成线", "日、地、月近似成线", "月球进入地球本影"],
        "tide_type": ["小潮", "大潮", "大潮与小潮之间的过渡潮", "无潮汐"],
        "range": ["潮差通常较小", "潮差通常较大", "潮差必定为零", "高潮一定淹没全部海岸"],
        "cycle": ["朔望月内通常有两组大潮和两组小潮", "一个朔望月只有一次小潮", "小潮只在太阳直射赤道时发生", "上弦月后月相不再变化"],
        "conclusion": ["小潮是相对较小的潮差，不等于海水停止涨落", "小潮就是没有高潮和低潮", "上弦月时月球不再产生引潮作用", "小潮只存在于北半球"]
      },
      "answers": { "geometry": "太阳与月球方向近似垂直", "tide_type": "小潮", "range": "潮差通常较小", "cycle": "朔望月内通常有两组大潮和两组小潮", "conclusion": "小潮是相对较小的潮差，不等于海水停止涨落" }
    },
    {
      "id": "TD-04", "case_id": "waxing-gibbous", "challenge": "上弦月以后、满月以前，潮差一般怎样演变？",
      "observations": ["日月方向夹角由90°向180°增大", "两种引潮作用再次趋向同一直线", "尚未达到满月位置"],
      "choices": {
        "geometry": ["日月方向夹角约135°", "太阳与月球方向近似垂直", "日、月位于地球同侧", "日月地完全重合"],
        "tide_type": ["大潮与小潮之间的过渡潮", "小潮", "大潮", "无潮汐"],
        "range": ["潮差总体由小变大", "潮差总体由大变小", "潮差立即归零", "潮差永远保持不变"],
        "cycle": ["约四分之一个朔望月后接近满月大潮", "下一小时必到满月", "一年后才到大潮", "下一次一定先到新月"],
        "conclusion": ["可判断向大潮过渡，但实测峰值可能相对满月略有滞后", "满月瞬间全球潮差同时最大", "只要潮差增大就一定发生海啸", "潮汐与日月位置无关" ]
      },
      "answers": { "geometry": "日月方向夹角约135°", "tide_type": "大潮与小潮之间的过渡潮", "range": "潮差总体由小变大", "cycle": "约四分之一个朔望月后接近满月大潮", "conclusion": "可判断向大潮过渡，但实测峰值可能相对满月略有滞后" }
    },
    {
      "id": "TD-05", "case_id": "full-moon", "challenge": "满月时太阳与月球分居两侧，两种引潮作用怎样组合？",
      "observations": ["太阳、地球、月球近似成线", "两种引潮作用的长轴仍沿近似同一直线", "当地仍有周期性的高潮和低潮"],
      "choices": {
        "geometry": ["日、地、月近似成线", "太阳与月球方向近似垂直", "日、月位于地球同侧，三者近似成线", "月球远离地球轨道"],
        "tide_type": ["大潮", "小潮", "大潮与小潮之间的过渡潮", "无潮汐"],
        "range": ["潮差通常较大", "潮差通常较小", "海面全天静止", "所有海岸潮高完全相同"],
        "cycle": ["约半个朔望月后，新月附近再次出现一组大潮", "下一次大潮要等一年", "满月大潮持续整个季度", "每天只在午夜出现一次高潮"],
        "conclusion": ["大潮取决于引潮作用近似同轴叠加，不要求太阳和月球位于地球同侧", "满月大潮是月光把海水照高", "只有月球同侧海岸才有潮汐", "满月必然引发灾害性风暴潮"]
      },
      "answers": { "geometry": "日、地、月近似成线", "tide_type": "大潮", "range": "潮差通常较大", "cycle": "约半个朔望月后，新月附近再次出现一组大潮", "conclusion": "大潮取决于引潮作用近似同轴叠加，不要求太阳和月球位于地球同侧" }
    },
    {
      "id": "TD-06", "case_id": "waning-gibbous", "challenge": "满月之后日月方向怎样变化，潮差通常朝哪个方向演变？",
      "observations": ["月球离开日地连线", "日月方向夹角向90°变化", "两种引潮作用不再同轴叠加"],
      "choices": {
        "geometry": ["日月方向夹角约135°", "太阳与月球方向近似垂直", "日、地、月近似成线", "日、月位于地球同侧"],
        "tide_type": ["大潮与小潮之间的过渡潮", "大潮", "小潮", "永久无潮"],
        "range": ["潮差总体由大变小", "潮差总体由小变大", "潮差突然固定", "潮差只由月光亮度决定"],
        "cycle": ["约四分之一个朔望月后接近下弦月小潮", "一天后回到新月", "下一次小潮要等一年", "月相与周期无关"],
        "conclusion": ["总体趋势可由几何解释，局地潮位还会叠加天气和海湾效应", "几何模型能替代港口潮汐预报", "潮差减小说明月球引力消失", "所有海岸的变化幅度完全相同"]
      },
      "answers": { "geometry": "日月方向夹角约135°", "tide_type": "大潮与小潮之间的过渡潮", "range": "潮差总体由大变小", "cycle": "约四分之一个朔望月后接近下弦月小潮", "conclusion": "总体趋势可由几何解释，局地潮位还会叠加天气和海湾效应" }
    },
    {
      "id": "TD-07", "case_id": "last-quarter", "challenge": "下弦月与上弦月的共同几何条件是什么，潮差有什么共同点？",
      "observations": ["太阳与月球方向约成直角", "太阳引潮作用与月球引潮作用部分抵消", "潮差相对大潮较小，但仍有涨落"],
      "choices": {
        "geometry": ["太阳与月球方向近似垂直", "日、地、月近似成线", "日、月位于地球同侧", "月球进入太阳内部"],
        "tide_type": ["小潮", "大潮", "大潮与小潮之间的过渡潮", "无潮汐"],
        "range": ["潮差通常较小", "潮差通常较大", "潮差必定为零", "海平面永久下降"],
        "cycle": ["上弦月与下弦月附近各有一组小潮", "小潮只在上弦月出现", "小潮每天恰好出现一次", "下弦月以后不再有大潮"],
        "conclusion": ["小潮描述潮差相对较小，不能推出某时刻一定是低潮", "看到下弦月就说明当地此刻必是低潮", "小潮与月相无关", "小潮时没有潮流" ]
      },
      "answers": { "geometry": "太阳与月球方向近似垂直", "tide_type": "小潮", "range": "潮差通常较小", "cycle": "上弦月与下弦月附近各有一组小潮", "conclusion": "小潮描述潮差相对较小，不能推出某时刻一定是低潮" }
    },
    {
      "id": "TD-08", "case_id": "waning-crescent", "challenge": "残月之后接近新月，日月方向与潮差通常如何演变？",
      "observations": ["日月方向夹角由90°向0°减小", "两种引潮作用趋向同一直线", "即将进入下一次新月阶段"],
      "choices": {
        "geometry": ["日月方向夹角约45°", "太阳与月球方向近似垂直", "日、地、月近似成线", "太阳与月球方向完全随机"],
        "tide_type": ["大潮与小潮之间的过渡潮", "小潮", "大潮", "无潮汐"],
        "range": ["潮差总体由小变大", "潮差总体由大变小", "潮差永久为零", "潮差只由季节决定"],
        "cycle": ["接近新月后进入下一组大潮，朔望月循环继续", "新月后月球停止公转", "下一次大潮要等到春季", "潮差不具有周期性"],
        "conclusion": ["“大潮”中的“大”指潮差较大，“春潮”也与春季无关", "大潮只在春天出现", "残月时潮汐由太阳单独造成", "潮差增大等同于海啸预警"]
      },
      "answers": { "geometry": "日月方向夹角约45°", "tide_type": "大潮与小潮之间的过渡潮", "range": "潮差总体由小变大", "cycle": "接近新月后进入下一组大潮，朔望月循环继续", "conclusion": "“大潮”中的“大”指潮差较大，“春潮”也与春季无关" }
    }
  ],
  "error_tags": {
    "TD-GEOMETRY-PHASE": "没有把月相转换成太阳—地球—月球方向关系",
    "TD-SPRING-NEAP": "混淆大潮、小潮与日月引潮作用的叠加方式",
    "TD-TIDAL-RANGE": "把潮差大小、高潮水位和是否发生潮汐混为一谈",
    "TD-LUNAR-DAY": "没有建立太阴日、每日常见潮次与朔望月潮序周期",
    "TD-LOCAL-BOUNDARY": "把理想潮汐规律写成任意港口的精确潮时潮高预报"
  },
  "sources": [
    { "title": "NASA Science: Tides", "url": "https://science.nasa.gov/moon/tides/", "supports": "月球与太阳的引潮作用、大潮小潮、太阴日和局地差异" },
    { "title": "NOAA: What are spring and neap tides?", "url": "https://oceanservice.noaa.gov/education/tutorial_tides/media/supp_tide06a.html", "supports": "新月满月大潮、上弦下弦小潮及每朔望月周期" },
    { "title": "NOAA: What is a lunar day?", "url": "https://oceanservice.noaa.gov/education/tutorial_tides/tides05_lunarday.html", "supports": "太阴日约24时50分、常见两次高潮约相隔12时25分" },
    { "title": "NOAA: Where do high tides occur?", "url": "https://oceanservice.noaa.gov/facts/high-tide.html", "supports": "现实海洋的高潮并非简单与月球正下方同步" },
    { "title": "NOAA: How frequent are tides?", "url": "https://oceanservice.noaa.gov/facts/tidefrequency.html", "supports": "近月侧与背月侧潮隆及多数海岸潮次" },
    { "title": "NOAA SciJinks: What causes tides?", "url": "https://scijinks.gov/about/k-12-education/oceans-coasts/what-causes-tides", "supports": "海岸地形、天气等对实际潮位的影响及局地潮型差异" }
  ]
}
